{
  "schemaVersion": "1.0.0",
  "reviewerCode": "R-ARCH24",
  "sample": "M-03",
  "conflictStatement": "Declaro que realicé esta revisión personalmente, de forma independiente, sin participación en COBRIA ni coordinación con el otro revisor.",
  "decisions": [
    {
      "id": "ENG-001",
      "decision": "supported",
      "confidence": 5,
      "rationale": "UIStateManager define estados idle, loading, empty, error y success y un catálogo de errores; hay un mecanismo centralizado explícito para representar estados operativos de pantalla."
    },
    {
      "id": "ENG-002",
      "decision": "insufficient",
      "confidence": 2,
      "rationale": "El código resuelve teamId y metadatos de contexto desde varias fuentes, pero no muestra transacción, commit, idempotencia ni punto único de autoridad para mutaciones."
    },
    {
      "id": "ENG-003",
      "decision": "insufficient",
      "confidence": 3,
      "rationale": "La clase persiste una cola y contabiliza pending, syncing, failed y synced, pero el fragmento no muestra límites, TTL, reintentos, idempotencia o dead-letter para gobernarla."
    },
    {
      "id": "ENG-004",
      "decision": "insufficient",
      "confidence": 3,
      "rationale": "El checklist menciona pruebas, auditoría y rollback y remite a otra documentación, pero no identifica SHA o digest ni demuestra promoción del mismo artefacto verificado."
    },
    {
      "id": "ENG-005",
      "decision": "insufficient",
      "confidence": 3,
      "rationale": "La implementación limpia y limita entradas, normaliza claves y calcula un fingerprint hash, pero el fragmento no demuestra que la telemetría sea no bloqueante ni qué campos persisten finalmente."
    },
    {
      "id": "ENG-006",
      "decision": "supported",
      "confidence": 5,
      "rationale": "El script calcula bytes HTML, JS y CSS por ruta, los compara con maxBytesPerRoute y marca fallo cuando excede el límite; el presupuesto es ejecutable."
    },
    {
      "id": "ENG-007",
      "decision": "supported",
      "confidence": 4,
      "rationale": "El contrato impide crecimiento del archivo legacy, prohíbe funcionalidad nueva allí y obliga a montar implementaciones nuevas antes del fallback preservando el contrato; la estrategia strangler es explícita."
    },
    {
      "id": "ENG-008",
      "decision": "insufficient",
      "confidence": 2,
      "rationale": "El fragmento mostrado trata identidades de servicio y nombres de Cloud Run; no evidencia causa raíz, acciones correctivas, riesgo residual ni un mecanismo de aprendizaje de incidentes."
    }
  ],
  "recommendation": "revise-manifest",
  "attestation": {
    "type": "human",
    "date": "2026-09-20",
    "independentWork": true
  }
}
