{
  "schemaVersion": "1.0.0",
  "reviewerCode": "R-ARCH24",
  "sample": "M-02",
  "conflictStatement": "Declaro que realicé esta revisión personalmente, de forma independiente, sin participación en COBRIA ni coordinación con el otro revisor.",
  "decisions": [
    {
      "id": "ENG-001",
      "decision": "supported",
      "confidence": 4,
      "rationale": "La política define estado offline visible y consecuencias concretas: no confirmar pagos o disponibilidad, no simular éxito y deshabilitar acciones server-side; el estado operativo es explícito."
    },
    {
      "id": "ENG-002",
      "decision": "supported",
      "confidence": 5,
      "rationale": "El ADR reconoce el ancestro común requerido por RTDB, prohíbe separar escrituras que romperían atomicidad y conserva autoridad transaccional para reservas, pagos y auditoría."
    },
    {
      "id": "ENG-003",
      "decision": "supported",
      "confidence": 4,
      "rationale": "La política excluye datos y operaciones críticas del caché offline y exige confirmación del backend; además documenta retry, idempotencia y dead-letter para operaciones diferidas, con gobierno explícito."
    },
    {
      "id": "ENG-004",
      "decision": "insufficient",
      "confidence": 3,
      "rationale": "Existe checklist de rollback y un reporte de verificaciones de una versión concreta, pero el fragmento no muestra SHA o digest ni prueba que el artefacto verificado sea exactamente el promovido."
    },
    {
      "id": "ENG-005",
      "decision": "insufficient",
      "confidence": 3,
      "rationale": "El sanitizador elimina campos con nombres sensibles y maneja errores y ciclos, pero no aparece aislamiento de fallos, fire-and-forget o garantía de que telemetría no bloquee la operación."
    },
    {
      "id": "ENG-006",
      "decision": "unsupported",
      "confidence": 5,
      "rationale": "El documento dice que los límites reales de reads, writes, Functions y costo todavía deben definirse con datos del piloto; por tanto el presupuesto operativo aún no está implementado."
    },
    {
      "id": "ENG-007",
      "decision": "supported",
      "confidence": 4,
      "rationale": "Se declaran dependencias permitidas y que los módulos legacy son solo reexportaciones, junto con generación desde un manifiesto canónico; la restricción de estrangulamiento está definida de forma concreta."
    },
    {
      "id": "ENG-008",
      "decision": "supported",
      "confidence": 5,
      "rationale": "El runbook exige cierre con causa raíz, impacto, timeline, evidencia, acciones, responsable y prueba de no regresión, además de revisión P1/P2; convierte incidentes en conocimiento verificable."
    }
  ],
  "recommendation": "revise-manifest",
  "attestation": {
    "type": "human",
    "date": "2026-09-20",
    "independentWork": true
  }
}
